{
  "brief_hash": "a1b2c3d4",
  "iteration": "001",
  "summary": "초안은 '좋은 프롬프트'에서 '파일 계약과 역할 분리'로 관점을 이동시키는 흐름이 분명하고, `runner.py`와 `validate.py`를 중심으로 한 설계 판단도 잘 잡혀 있다. 다만 회고의 핵심인 시행착오와 다음 실험이 아직 개념어 위주라, 읽는 사람이 실제 변경의 감각을 조금 덜 받는다.",
  "strengths": [
    "프롬프트보다 파일 계약과 역할 분리가 중요하다는 핵심 통찰이 초반부터 끝까지 일관되게 유지된다.",
    "`runner.py`와 `validate.py`를 구체적으로 지목해 추상적인 회고가 설계 판단의 기록으로 읽힌다.",
    "MVP를 먼저 고정했다는 결론이 글의 방향을 현실적으로 정리해 주며, 차분한 개발자 회고 톤도 잘 맞는다."
  ],
  "weaknesses": [
    {
      "issue": "`runner.py` 책임이 커졌던 시행착오가 방향성은 분명하지만, 어떤 책임이 어떻게 붙었는지의 장면이 너무 압축돼 있다.",
      "why_it_matters": "brief에서 반드시 요구한 핵심 장면인데, 구체적 실패 양상이 없으면 독자는 '그래서 무엇이 잘못됐는지'보다 '원론적으로 옳은 말'로 받아들이기 쉽다.",
      "suggestion": "`runner.py`에 어떤 책임이 붙기 시작했는지 1~2가지만 더 구체적으로 짚고, 그때 왜 흐름 제어와 도메인 책임이 섞였는지 한 문장으로 붙여라. brief에 재료가 있다면 입력 구성, 출력 저장, 검증 호출, 예외 처리 중 실제 사례를 골라라.",
      "severity": "medium"
    },
    {
      "issue": "역할 분리의 필요성은 잘 드러나지만, Generator/Critique/Eval/Refine/Validate가 나열되면서 설계 원리보다 도구 목록처럼 읽히는 구간이 있다.",
      "why_it_matters": "이 글의 가치는 '무엇을 분리했는가'보다 '왜 분리해야 안정성과 수정 가능성이 생기는가'에 있는데, 그 연결이 약하면 글이 구조 설명에서 멈춘다.",
      "suggestion": "각 역할이 무엇을 보지 않게 만들었는지와 그 결과 어떤 실패가 더 읽히게 되었는지를 한 번 더 연결해라. 특히 `validate.py`는 왜 문학적 판단을 내려서는 안 되는지 기준을 짧고 선명하게 압축해라.",
      "severity": "medium"
    },
    {
      "issue": "다음 실험이 안전한 방향으로 제시되지만, 아직 독자가 바로 떠올릴 수 있는 관찰 기준이 부족하다.",
      "why_it_matters": "회고의 마무리는 다음 행동을 예고하는 데 그치지 않고, 무엇을 확인할지까지 보여 줄 때 설득력이 생긴다.",
      "suggestion": "최소 경로를 안정적으로 재실행하면서 볼 항목을 2~3개로 좁혀라. 예를 들어 어떤 계약이 가장 자주 흔들리는지, 어느 단계에 정보가 몰리는지, 실패 원인이 구조 문제인지 출력 문제인지 구분하는 기준을 적어라.",
      "severity": "low"
    }
  ],
  "revision_directions": [
    "현재의 큰 흐름은 유지하되, `runner.py` 책임이 커졌던 실제 장면을 한 번만 더 구체화해라.",
    "역할 분리 단락에서는 파일 이름 나열보다 '각 단계가 무엇을 보지 않게 되는가'를 중심 문장으로 세워라.",
    "`validate.py`의 역할은 기계적 계약 검사로 한정된다는 점을 짧고 단호하게 정리해라.",
    "마지막 문단은 다음 실험의 범위를 줄이고, 독자가 확인 가능한 관찰 포인트를 포함시켜라."
  ],
  "reader_risks": [
    "독자는 핵심 결론은 이해하지만, 실제로 어떤 코드 변화가 있었는지 체감하지 못해 회고가 개념 정리처럼 읽힐 수 있다.",
    "`runner.py`와 `validate.py`의 책임 분리가 왜 필요한지 납득하더라도, 구체적 실패 장면이 없어 문제의 긴급도가 약하게 느껴질 수 있다.",
    "마지막 문장이 원론적으로 들리면 다음 실험이 실무적으로 무엇인지 바로 떠올리기 어렵다."
  ],
  "critiqued_at": "2026-06-14T16:45:24+09:00",
  "model": "gpt-5.4-mini",
  "metadata": {
    "prompt_version": "critique_system:v1",
    "source_files": [
      "a1b2c3d4_input.json",
      "a1b2c3d4_iter-001_draft.json"
    ],
    "token_usage": {
      "input_tokens": 61894,
      "cached_input_tokens": 46592,
      "output_tokens": 2782,
      "reasoning_output_tokens": 1539
    }
  }
}
