{
  "brief_hash": "8dbc7a7c",
  "iteration": "002",
  "summary": "정책 우선순위, 주요 경계값, 주문/환불 상태 전이를 폭넓게 고정한 초안이다. 다만 0원 일할 환불 처리에서 정책에 없는 동작을 단정하고, 부분 환불 상태에서 7일 무료·환불 가능 금액 상한이 만나는 케이스가 빠져 있어 실제 도메인 규칙을 잘못 봉인할 위험이 있다.",
  "strengths": [
    "MANUAL > 7일 이하 무료 > PRORATION 우선순위를 Gherkin과 JUnit 양쪽에서 명확히 드러낸 점은 보존할 가치가 있다.",
    "일할 계산의 당일, 마지막 날, 만료 후, 정수 나눗셈 절사, totalDays <= 0 예외를 표로 묶어 경계값을 읽기 쉽게 고정했다.",
    "주문 상태 전이를 PAID와 PARTIALLY_REFUNDED 각각의 전액/부분 환불 조합으로 나누어 검증한 점이 좋다.",
    "Refund의 REQUESTED 생성과 SUCCEEDED, FAILED, TIMED_OUT 전이를 별도 테스트로 분리해 상태 머신 의도가 잘 보인다."
  ],
  "weaknesses": [
    {
      "issue": "만료 후 PRORATION 결과가 0원일 때 '환불 요청을 생성하지 않는다', '0원 환불 요청은 생성할 수 없다', 'cancelZeroAmount' 같은 동작을 정책 근거 없이 추가했다.",
      "why_it_matters": "원문은 remainingDays == 0이면 환불금액 0원이라고만 말하고, 0원 산출 이후 요청 생성 여부나 예외 여부는 명시하지 않는다. 이 테스트가 통과 기준이 되면 구현이 정책이 아니라 초안의 추가 해석에 묶일 수 있다.",
      "suggestion": "0원 PRORATION 케이스는 우선 '환불 금액은 0원'까지만 단언하고, 환불 요청 미생성 또는 예외 처리는 정책/원문에 근거가 있다면 별도 요구사항으로 분리해 테스트에 반영한다.",
      "severity": "high"
    },
    {
      "issue": "부분 환불 상태에서 7일 이하 무료 규칙이 환불 가능 금액 상한과 만나는 케이스가 없다.",
      "why_it_matters": "정책은 환불 가능 금액을 '주문금액 - 이미 환불된 금액'으로 정의하고 이를 초과할 수 없다고 한다. 그런데 7일 이하 무료는 전액 환불이라고 표현되어 있어, 이미 일부 환불된 주문에서 전액의 기준이 주문금액인지 환불 가능 금액인지가 테스트로 고정되지 않는다.",
      "suggestion": "이미 환불된 금액이 있는 주문에서 경과일 <= 7이고 MANUAL이 없을 때 산출 금액과 환불 유형이 환불 가능 금액 기준으로 결정되는지 시나리오와 단위 테스트를 추가한다.",
      "severity": "high"
    },
    {
      "issue": "환불 가능 여부의 정상 케이스가 refundAmount == cancellableAmount에 치우쳐 있고, refundAmount < cancellableAmount인 허용 케이스가 없다.",
      "why_it_matters": "정책은 환불금액 <= cancellableAmount를 허용한다. 현재 허용 예시는 등호 경계만 확인하므로, 구현이 '<'인 부분 환불을 잘못 거절해도 상태 전이 테스트 외의 검증 지점에서 명확히 드러나지 않을 수 있다.",
      "suggestion": "PAID와 PARTIALLY_REFUNDED 각각에 대해 환불 가능 금액보다 작은 금액이 validateRefundable에서 허용되는 예시를 추가한다.",
      "severity": "medium"
    },
    {
      "issue": "Gherkin의 일부 Then이 '거절된다'만 말하고 어떤 상태나 부작용이 없어야 하는지 충분히 고정하지 않는다.",
      "why_it_matters": "수동 금액 오류, 환불 불가 상태, 초과 금액 케이스에서 거절만 확인하면 환불 금액이 일부 계산되거나 주문 상태가 바뀌는 잘못된 구현도 단계 정의에 따라 통과할 수 있다.",
      "suggestion": "오류 시에는 '환불 금액은 확정되지 않는다', '주문 상태와 환불 가능 금액은 변경되지 않는다', '환불 요청은 생성되지 않는다'처럼 정책에 근거한 무부작용 단언을 필요한 시나리오에 추가한다.",
      "severity": "medium"
    }
  ],
  "revision_directions": [
    "정책에 명시된 규칙과 초안이 추가한 해석을 분리하고, 0원 PRORATION 이후 처리처럼 근거가 약한 단언은 제거하거나 조건부 요구사항으로 낮춘다.",
    "환불 가능 금액 상한과 다른 정책이 충돌하는 조합, 특히 부분 환불 이후 7일 이하 무료와 MANUAL 경계를 보강한다.",
    "허용/거절 경계는 등호 양쪽을 짝으로 둔다. '< cancellableAmount', '= cancellableAmount', '> cancellableAmount'를 각각 드러내면 회귀 탐지력이 좋아진다.",
    "거절 시나리오는 단순 실패 메시지보다 상태 불변, 요청 미생성, 외부 의존 미호출 같은 관찰 가능한 결과를 함께 고정한다."
  ],
  "reader_risks": [
    "정책에 없는 0원 환불 처리 방식이 도메인 결정처럼 굳어져 이후 구현과 문서가 초안의 추정에 맞춰질 위험이 있다.",
    "부분 환불 후 7일 무료 케이스가 빠져 중복 환불 또는 환불 가능 금액 초과 산출을 놓칠 수 있다.",
    "거절 시나리오의 부작용 단언이 약하면 오류를 반환하면서 내부 상태를 변경하는 구현이 가짜로 통과할 수 있다."
  ],
  "critiqued_at": "2026-07-06T21:07:58+09:00",
  "model": "gpt-5.5",
  "metadata": {
    "prompt_version": "critique_system:v1",
    "source_files": [
      "8dbc7a7c_input.json",
      "8dbc7a7c_iter-002_draft.json"
    ],
    "token_usage": {
      "input_tokens": 38939,
      "cached_input_tokens": 2432,
      "output_tokens": 1785,
      "reasoning_output_tokens": 516
    }
  }
}
