{
  "brief_hash": "6ec3182a",
  "iteration": "001",
  "summary": "두 진입점(빈자리 알림 신청, 코트·날짜 예약 상태 조회)의 경계 행동을 When 1:1로 잘 나눴고, 멱등 표식·동시 요청·신선도 갈림 같은 hazard를 시나리오로 세운 점이 강하다. 다만 시간 축의 기준값인 '확인 간격'이 끝까지 상대 표현으로 남아 경계가 값으로 고정되지 않았고, 정책이 요구하는 사용자 축(같은 조건이라도 사람이 다르면 별개 신청, 표식은 사용자 단위 보관)이 통째로 빠져 있다. 경계 시나리오도 '안/밖'만 있고 '정확히 그 값'인 행이 없어 부등호 방향을 틀린 구현이 통과한다.",
  "strengths": [
    "When이 두 진입점(알림 신청 / 예약 상태 조회) 각각에 1:1로 대응하고, 내부 확인 루프나 발송 경로를 When으로 끌어오지 않았다. 발송·해제·만료는 Given의 전제로만 쓰여 범위 경계를 지켰다.",
    "전송 형식(상태 코드·헤더·에러 코드 상수·필드명)을 드러내지 않고 '재시도 표식', '오래된 결과', '앞선 요청의 재생' 같은 도메인 말로 관찰 결과를 적었다.",
    "멱등 표식의 네 갈래(같은 표식·같은 조건 / 같은 표식·다른 조건 / 거절은 표식에 묶이지 않음 / 보관 기간 경과)를 각각 독립 시나리오로 세워 서로 다른 결함이 서로 다른 시나리오를 깨도록 나눴다.",
    "확인 실패 시 '저장된 성공 결과가 있음 → 오래된 결과로 성공' 과 '없음 → 실패'의 갈림을 두 시나리오로 대비시켜, 한쪽만 구현한 코드가 반드시 red가 된다.",
    "동시 조회·연달은 조회에서 결과 동일성과 확인 시각 동일성을 함께 단언해, 값이 같아도 각자 따로 확인해 버린 구현을 걸러낼 여지를 남겼다.",
    "Background가 지원 코트·운영 시간대·초기 저장 상태를 선언해 시나리오 간 상태 의존이 거의 없다."
  ],
  "weaknesses": [
    {
      "issue": "시간 경계의 기준값인 '확인 간격'이 구체 값으로 고정되지 않아, 경계를 '확인 간격에서 1초 모자란 시간', '확인 간격의 세 배를 1초 넘긴 때' 같은 상대 표현으로만 적었다. 그 결과 Then도 '확인 시각은 2026-10-01 11:00:00보다 나중'처럼 범위 단언으로 내려앉았다.",
      "why_it_matters": "어느 값에서 동작이 갈리는지가 feature 안에서 고정되지 않으면, 이 명세를 읽는 사람과 구현이 서로 다른 간격을 가정해도 시나리오가 통과한다. 재확인을 일으키는 시점과 확인 밀림 판정 시점은 이 진입점의 관찰 결과를 직접 바꾸는 값이라 경계 자체가 명세의 일부다.",
      "suggestion": "Background나 Given에 '확인 간격은 5분이다'처럼 예시 값 하나를 못 박고, 그 값에서 유도된 구체 시각으로 Examples를 다시 쓴다(예: 마지막 확인 11:00:00, 조회 시각 11:04:59 / 11:05:01, 확인 밀림 판정 시각 11:14:59 / 11:15:01). 그 값이 정책상 얼마여야 하는지와 어떻게 계산해 그 시각이 나오는지는 rules 문서 몫이고, feature에는 '이 시각에 이 결과'만 남긴다. Then의 '보다 나중'도 Given으로 고정한 현재 시각을 그대로 쓴 구체 시각 단언으로 바꾼다.",
      "severity": "high"
    },
    {
      "issue": "사용자 축이 통째로 빠졌다. 모든 신청 시나리오가 '지민' 한 사람이며, 다른 사용자가 같은 코트·날짜·시간대를 감시 중일 때 어떻게 되는지, 다른 사용자가 같은 재시도 표식을 썼을 때 어떻게 되는지를 고정한 시나리오가 없다.",
      "why_it_matters": "정책은 '같은 사용자의 같은 조건을 감시하는 신청은 하나만 저장된다'와 '표식은 사용자와 진입점 단위로 보관한다'를 함께 말한다. 사용자 축이 없으면 중복 판정과 표식 조회를 사용자 구분 없이 전역으로 구현한 코드가 이 feature를 전부 통과한다. 이것은 남의 신청을 재생해 돌려주는 결함으로 이어지는 자리라 게이트가 반드시 잡아야 한다.",
      "suggestion": "두 시나리오를 추가한다. (1) 지민이 양재 1번 코트 2026-10-08 08:00~10:00을 감시 중일 때 다른 사용자 수아가 같은 조건으로 신청하면 새 신청이 만들어지고, 감시 중인 신청은 지민 1건·수아 1건이 된다. (2) 지민이 표식 K-1로 신청해 둔 뒤 수아가 같은 표식 K-1로 자기 조건을 신청하면 재생도 거절도 아닌 수아의 새 신청이 만들어진다. 두 시나리오 모두 관찰은 '누구의 감시 중 신청이 몇 건인지'와 '돌려받은 신청이 누구 것인지'로만 적는다.",
      "severity": "high"
    },
    {
      "issue": "경계 시나리오가 '경계 밖'과 '경계 안'만 담고 '정확히 경계값'인 행을 빼놨다. 이용 시작 시각 판정은 07:59와 08:01만 있고 08:00이 없으며, 재확인 판정은 '1초 모자란'과 '1초 넘긴'만 있고 정확히 확인 간격만큼 지난 때가 없다. 확인 밀림 판정의 세 배 지점도 같다.",
      "why_it_matters": "빠진 것이 바로 부등호의 등호 포함 여부다. '이미 지났다'와 '보다 오래됐다'를 양끝 두 점만으로 고정하면, 등호를 반대로 구현한 코드가 red가 되지 않는다. 경계 명세에서 가장 자주 어긋나는 지점이 명세에 없는 셈이다.",
      "suggestion": "각 Outline에 경계값 자체를 한 행씩 더한다. 이용 시작 시각이 정확히 2026-10-04 08:00일 때의 결과, 마지막 확인에서 정확히 확인 간격만큼 지났을 때 재확인이 일어나는지 여부, 마지막 성공 확인에서 정확히 확인 간격의 세 배가 지났을 때 확인 밀림이 드러나는지 여부. 어느 쪽으로 정할지는 정책 문구('이미 지난', '보다 오래됐거나')를 그대로 따르고, feature에는 그 한 행의 입력과 결과만 적는다.",
      "severity": "medium"
    },
    {
      "issue": "일부 Then이 선택지를 열어 두거나 값을 비워 둬 틀린 구현에서도 통과한다. '각 요청은 같은 신청 하나를 돌려받거나 잠시 뒤 다시 보내라는 안내를 받는다'는 두 결과를 모두 허용하고, '얼마나 기다렸다 보내야 하는지가 함께 온다'는 그 값이 얼마인지를 비워 두며, '돌려받은 결과에는 어떤 사용자를 가리키는 내용도 없다'는 무엇이 없어야 하는지를 특정하지 않는다.",
      "why_it_matters": "이런 단언은 게이트로서 통과 폭이 너무 넓다. 서로 다른 표식의 동시 신청 시나리오는 두 요청이 모두 물러나도, 한쪽만 성공해도, 둘 다 같은 신청을 받아도 같은 판정을 받는다. 대기 시간이 빠지면 안내만 하고 값을 안 주는 구현이 통과한다.",
      "suggestion": "서로 다른 표식의 동시 신청은 결과를 하나로 좁혀 쓴다 — '두 요청이 돌려받은 신청은 서로 같은 하나이거나, 한 요청은 그 신청을 받고 다른 요청은 물러난다' 대신 관찰 가능한 불변식으로: '두 요청이 끝난 뒤 지민이 감시 중인 신청은 1건이고, 성공한 요청이 돌려받은 신청은 모두 그 신청이다'. 대기 안내는 Given에 확인 간격을 고정한 뒤 '다시 보내기까지 기다릴 시간은 확인 간격과 같은 값으로 온다'처럼 값을 특정하고, 사용자 정보 부재는 '돌려받은 결과는 사용자를 식별하지 않은 조회와 식별된 조회가 서로 같다'처럼 비교 가능한 단언으로 바꾼다.",
      "severity": "medium"
    }
  ],
  "revision_directions": [
    "Background에 확인 간격 예시 값을 한 번 선언하고, 시간이 걸린 모든 Examples를 그 값에서 나온 구체 시각으로 다시 쓴다. 값이 왜 그렇게 나오는지는 적지 않는다.",
    "신청 feature에 사용자 둘을 등장시켜 '같은 조건, 다른 사용자'와 '같은 표식, 다른 사용자' 두 경계 행동을 추가한다.",
    "세 개의 시간 경계(이용 시작 시각, 확인 간격, 확인 간격의 세 배) Outline에 경계값 자체인 행을 각각 한 줄씩 더한다.",
    "'~거나', '함께 온다', '어떤 ~도 없다'로 끝나는 Then을 찾아 결과를 하나로 좁히거나 구체 값·비교 대상으로 바꾼다.",
    "조회 feature의 '지원하지 않는 코트'와 '날짜로 읽을 수 없는 값' 시나리오에도 저장된 확인 결과 유무를 Given으로 명시해, 거절이 저장 상태와 무관함을 고정한다."
  ],
  "reader_risks": [
    "'예약처에 쌓인 확인 이력은 한 건만 늘어난다'는 외부 협력에 남은 누적 상태로 적혀 있지만, 구현이 이력을 노출하지 않으면 바인딩 시 호출 횟수 검증으로 번역되기 쉽다. 그러면 재시도·병합 전략을 바꾸는 리팩터링에서 동작이 그대로인데도 가짜로 깨진다. 무엇을 관찰해 이 수를 세는지(예약처가 받은 조회 이력인지, 서비스가 남긴 확인 기록인지)를 한 문장으로 못 박아 두면 위험이 준다.",
    "'지민이 감시 중인 신청은 N건이다'는 이 feature의 범위 밖인 신청 목록 조회로만 확인할 수 있다. 바인딩하는 사람이 관찰 수단을 찾지 못해 저장소를 직접 들여다보는 단언으로 내려가면, 저장 구조를 바꾸는 리팩터링마다 이 feature가 깨진다.",
    "확인 밀림 여부를 신청 진입점의 응답으로 관찰한다. 조회 진입점이 범위 밖이라 생긴 우회인데, 읽는 사람은 확인 밀림이 신청 처리의 결과라고 오해하기 쉽다. Feature 서두에 '확인 밀림은 신청을 다시 받을 때 함께 드러나는 값이며 신청이 만드는 값이 아니다'를 한 줄 덧붙이면 오해가 줄고, 나중에 조회 진입점으로 시나리오를 옮길 때 기준이 된다.",
    "두 feature가 '확인 간격'을 각자 서두에서 따로 설명한다. 한쪽만 값을 고치면 두 문서가 어긋나며, 읽는 사람은 두 간격이 같은 것인지 확신하지 못한다.",
    "재시도 표식 보관 기간(24시간)이 Examples의 2026-10-02 11:09 / 11:11이라는 시각으로만 나타나 있어, 읽는 사람이 그 두 시각 사이 어디가 경계인지를 스스로 역산해야 한다. 보관 기간을 Given으로 한 번 선언하면 시각의 뜻이 바로 읽힌다."
  ],
  "critiqued_at": "2026-09-22T12:06:00+09:00",
  "model": "claude-sonnet-4-6",
  "metadata": {
    "prompt_version": "critique_system:v1",
    "source_files": [
      "6ec3182a_input.json",
      "6ec3182a_iter-001_draft.json"
    ]
  }
}
