{
  "brief_hash": "d1309fc2",
  "iteration": "001",
  "summary": "핵심 산식 대부분은 예시표로 잘 분리됐지만, 스퀴즈 백분위는 기대값이 입력 데이터에서 재계산되지 않고, 발화 게이트는 일부 단일 위반 경계가 빠져 특수해가 통과할 여지가 있습니다.",
  "strengths": [
    "볼린저밴드 산출 예시는 모집단 표준편차로 직접 검산 가능하며, 100이 19개와 120이 1개인 행도 중심 101, σ=sqrt(19), 상단 109.717798, 하단 92.282202로 맞습니다.",
    "몸통 중점 이탈 판정은 등호 경계를 미이탈로 둔 안/밖 짝을 상방과 하방 모두 포함합니다.",
    "진입·손절·리스크·목표 산출은 상방 106-100=6, 목표 118과 하방 99-94=5, 목표 84처럼 정책 산식으로 재계산 가능합니다.",
    "방향 배타성은 전칭 불변식으로 승격되어 있어 단순 예시표만으로 표현되지 않았습니다.",
    "볼린저밴드 산출 규칙은 반례를 구성하지 못함(충분히 좁혀짐).",
    "진입·손절·리스크·목표 산출 규칙은 리스크 0과 0.01 경계를 포함해 반례를 구성하지 못함(충분히 좁혀짐)."
  ],
  "weaknesses": [
    {
      "issue": "스퀴즈 표의 기대 판정은 정책 산식에서 직접 재계산되지 않습니다.",
      "why_it_matters": "현재 표는 '최근 100개 기준 하위 백분위'를 이미 계산된 입력처럼 받아들이므로, 최근 100개 밴드폭으로 25.00%와 25.01%가 어떻게 도출되는지 검산할 수 없습니다. 백분위 산출 방식이 달라져도 표를 통과할 수 있습니다.",
      "suggestion": "최근 100개 밴드폭을 압축된 멀티셋으로 제시하고, 백분위 산출 규칙을 도메인 산식으로 고정한 뒤 현재 밴드폭이 정확히 25%인 행과 25%를 초과하는 행을 재계산 가능하게 추가하세요.",
      "severity": "high"
    },
    {
      "issue": "이 입력/구현이 표를 통과하지만 '방향별 마감 조건, 몸통 중점 이탈, 첫 전이, 스퀴즈, 리스크 양수가 모두 참일 때만 발화' 정책을 위반함: 상방에서 마감 조건만 거짓이거나 첫 전이만 거짓인 경우를 발화 게이트 결합 표가 직접 막지 않습니다.",
      "why_it_matters": "발화 게이트 결합 표는 상방의 스퀴즈 거짓·리스크 0, 하방의 첫 전이 거짓·리스크 0만 다룹니다. 유한 예시를 외운 구현이 상방 첫 전이 거짓 또는 상방 마감 조건 거짓을 발화시켜도 결합 표만으로는 드러나지 않습니다.",
      "suggestion": "발화 게이트 결합 표에 방향별로 각 조건을 하나씩만 거짓으로 만든 행을 모두 추가하세요. 상방과 하방 각각 마감 조건 거짓, 몸통 중점 이탈 거짓, 첫 전이 거짓, 스퀴즈 거짓, 리스크 0의 단일 위반 행이 필요합니다.",
      "severity": "medium"
    },
    {
      "issue": "이 입력/구현이 표를 통과하지만 '닫힌 캔들 기준' 정책과 boundary feature의 열린 캔들 무시 규칙을 위반함.",
      "why_it_matters": "draft의 예시표는 닫힌 기준봉이라는 전제를 방향 배타성 불변식 문장에만 일부 담고, 열린 캔들이 조건을 만족해도 무시해야 하는 안/밖 짝을 규칙 예시표로 채우지 않습니다. 열린 캔들까지 평가하는 구현이 계산표를 통과할 수 있습니다.",
      "suggestion": "닫힌 캔들 여부를 도메인 입력 값으로 둔 예시표를 추가하세요. 마지막 닫힌 캔들이 발화 조건을 만족하고 최신 열린 캔들도 존재하는 경우에는 마지막 닫힌 캔들 기준으로 발화하며, 열린 캔들만 조건을 만족하는 경우에는 미발화가 되도록 짝을 구성하세요.",
      "severity": "medium"
    },
    {
      "issue": "스퀴즈 불변식이 전칭 문장으로 고정되지 않았습니다.",
      "why_it_matters": "정책은 모든 입력에 대해 '밴드폭 백분위 <= 25%'와 스퀴즈 판정이 동치여야 함을 요구합니다. 현재는 몇 개의 백분위 예시만 있어, 특정 값만 맞추고 다른 백분위에서 뒤집히는 특수해가 통과할 수 있습니다.",
      "suggestion": "불변식으로 '∀(최근 100개 밴드폭, 현재 밴드폭). 스퀴즈 ⇔ 현재 밴드폭의 하위 백분위 <= 25%'를 추가하고, 등호 tight witness와 25% 바로 초과 witness 행을 재계산 가능한 최근 100개 입력과 함께 두세요.",
      "severity": "medium"
    },
    {
      "issue": "몸통 중점 이탈 산식이 source_material의 'mid >= upper' 서술과 input policy_rules의 '경계 등호는 미이탈' 사이 차이를 해소하지 않습니다.",
      "why_it_matters": "draft는 policy_rules의 strict 비교를 따르지만, 같은 입력 JSON 안의 source_material에는 '몸통 절반 이상'을 mid >= upper로 둔 설명도 있습니다. 독자는 등호가 이탈인지 미이탈인지 혼동할 수 있고, 이후 계약 feature와 규칙 예시표가 다른 경계로 잠길 위험이 있습니다.",
      "suggestion": "규칙 예시표에는 현재처럼 등호 미이탈 행을 유지하되, 정책 결정 근거를 '경계 등호는 미이탈'로 명시하고 boundary feature 또는 원문 산식과의 차이는 별도 결정 사항으로 정리해 한 기준만 남기세요.",
      "severity": "medium"
    }
  ],
  "revision_directions": [
    "스퀴즈 섹션을 가장 먼저 보강하세요. 백분위 값을 결과로 주장하지 말고 최근 100개 밴드폭 입력에서 산출되게 만드세요.",
    "발화 게이트 결합 표는 상방·하방 각각 모든 단일 위반 조건을 한 행씩 갖도록 확장하세요.",
    "닫힌 캔들/열린 캔들 경계는 boundary feature가 요구한 계산 명세 보강 대상이므로 규칙 예시표에 별도 섹션으로 추가하세요.",
    "등호 경계는 input 내부의 상충 가능성이 있으므로 '미이탈'으로 확정할지 '절반 이상'의 포함 경계로 바꿀지 사람이 한 번 결정한 뒤 문서 전반을 일관화하세요."
  ],
  "reader_risks": [
    "스퀴즈 백분위가 재계산되지 않아 값 환각이 그대로 명세로 굳을 위험이 있습니다.",
    "발화 게이트 단일 위반 행이 일부 빠져 조건 누락 구현이 특수해로 통과할 위험이 있습니다.",
    "닫힌 캔들 기준이 예시표에 없으면 진행 중 캔들로 재점화하거나 중복 알림을 내는 구현을 막지 못할 수 있습니다.",
    "등호 경계가 원문 산식과 정책 규칙 사이에서 다르게 읽히면 몸통 절반 판정이 구현마다 갈릴 수 있습니다."
  ],
  "critiqued_at": "2026-07-24T00:16:02+09:00",
  "model": "gpt-5.5",
  "metadata": {
    "prompt_version": "critique_system:v1",
    "source_files": [
      "d1309fc2_input.json",
      "d1309fc2_iter-001_draft.json"
    ],
    "token_usage": {
      "input_tokens": 31738,
      "cached_input_tokens": 1408,
      "cache_write_input_tokens": 0,
      "output_tokens": 2206,
      "reasoning_output_tokens": 516
    }
  }
}
