{
  "brief_hash": "f1ba346d",
  "iteration": "001",
  "summary": "다섯 개 feature로 금액 결정·유형 결정·수락/거절·주문 상태 전이·결제 취소 결과를 경계 행동으로 나눴고, 산식은 rules로 미루고 입출력 값만 고정한 고도 판단이 대체로 좋다. 다만 결제취소 결과 처리와 유형 결정 두 파일에서 When이 실제 인바운드 사건과 어긋나 게이트 자격이 약해지는 지점이 있다.",
  "strengths": [
    "환불금액_결정에서 일할 계산의 산식(일할 단가·정수 나눗셈)을 feature에 넣지 않고 결제금액·총일수·잔여일수 입력 → 환불금액 출력의 구체 값 쌍(15000/1000/0/2331)만 고정해 경계 고도를 지켰다. 산출 과정은 rules 몫이라는 분리를 다음 draft에서도 유지할 것.",
    "대부분의 시나리오가 When을 '환불을 요청하면' 하나의 인바운드 포트로 일관되게 두고, Then은 수락/거절·주문 상태·환불 유형 같은 도메인 관찰 결과만 단언해 호출 순서·횟수·원시 기본값 단언을 피했다.",
    "경계의 양쪽을 값으로 함께 고정했다: 7일/8일, 환불 가능 금액 10000/10001, 유형 30000/29999, totalDays 1/0, 주문 상태 4종 전이 — 한쪽만 있는 누락이 적다.",
    "'거절된 환불은 환불 가능 금액을 10000원으로 유지한다'처럼 거절 시 부작용 없음을 구체 값으로 관찰해, 거절 경로의 상태 불변을 게이트로 고정했다."
  ],
  "weaknesses": [
    {
      "issue": "결제취소_결과_처리.feature의 When '환불을 요청하면'이 Given '전액 환불 요청이 수락되었다'와 중복되어, 실제 트리거인 결제 취소 결과 수신이 Given의 '결제 취소가 <취소결과> 상황이다' 안에 묻혀 있다.",
      "why_it_matters": "이 시나리오의 관찰(성공/실패/타임아웃 마무리, 주문 상태 변화)은 결제 취소 결과라는 인바운드 사건에 걸린 것인데, When이 이미 끝난 환불 요청을 다시 트리거로 세워 When=인바운드 포트 1:1이 깨진다. 리팩터링 시 결과 처리 진입점이 환불 요청과 분리되면 이 시나리오가 가짜로 깨지거나 무엇이 관찰을 촉발하는지 모호해진다.",
      "suggestion": "When을 실제 인바운드 사건(결제 취소 결과의 수신/콜백)으로 바꾸고, Given은 '전액 환불 요청이 이미 수락되어 결제 취소가 요청된 상태'로 상태만 세팅한 뒤 재요청 표현을 지운다. 결과가 어떻게 도출되는지 절차·구현은 넣지 말고 사건명만 쓴다.",
      "severity": "high"
    },
    {
      "issue": "환불유형_결정.feature가 '확정된 환불 금액이 <환불금액>원이다'를 Given 입력으로 주입한 뒤 When을 다시 '환불을 요청하면'으로 둔다. 확정 환불 금액은 금액 결정 유스케이스의 산출물인데 이를 별도 유스케이스의 입력으로 체이닝했다.",
      "why_it_matters": "유형 결정은 독립 인바운드 포트가 아니라 환불 요청의 결과인데, 산출된 중간 결과를 입력으로 미리 고정하고 요청을 다시 트리거해 When이 이중이 된다. 유형 판정이 환불 요청 흐름에 통합되도록 리팩터링하면 '금액을 먼저 받아 유형만 반환하는' 이 프레이밍이 실제 경계와 어긋나 가짜로 깨질 수 있다.",
      "suggestion": "유형을 별도 요청이 아니라 환불 요청 결과의 Then 관찰로 표현하되, 입력은 결제금액·기환불·경과일 같은 정책 입력으로 두고 유형(전액/부분)을 경계 관찰로 고정한다. 유형이 금액에서 어떻게 갈리는지 산식은 넣지 않는다.",
      "severity": "medium"
    },
    {
      "issue": "결제취소_결과_처리.feature의 취소결과 조건('명확히 거부되는' vs '응답이 불확실한')과 환불결과('성공으로 마무리된다', '관리자 수동 처리 대상이 된다')가 정성 서술로만 뭉개져, 어떤 관찰 가능한 환불 결과 상태에 대응하는지 값으로 고정되지 않는다.",
      "why_it_matters": "'관리자 수동 처리 대상이 된다'가 틀린 구현(예: 실패로 마무리)에서도 서술상 그럴듯하게 통과할 여지가 있어, 실패와 타임아웃을 뒤바꾼 구현이 red가 되지 못할 수 있다. 결과 상태가 값으로 고정되지 않으면 게이트가 무뎌진다.",
      "suggestion": "환불결과를 관찰 가능한 도메인 결과명(성공 처리 / 실패 처리 / 타임아웃-수동처리 대기)으로 각각 값 고정하고, 취소결과는 외부 사건 범주이므로 도메인 사건명(성공 / 명확한 거부 / 불확실)으로 명명해 셋이 서로 구별되게 한다. 결과가 도출되는 절차는 넣지 않는다.",
      "severity": "medium"
    }
  ],
  "revision_directions": [
    "결제 취소 결과 시나리오의 When을 '결제 취소 결과를 수신하면'류의 인바운드 사건으로 교체하고, 선행 환불 요청 수락은 Given 상태로만 남겨 재요청 중복을 제거한다.",
    "환불 유형 결정을 별도 요청 트리거가 아니라 환불 요청 결과의 경계 관찰로 재구성하거나, 유형 매핑만 독립 고정이 필요하면 그 매핑에 맞는 인바운드 포트를 명확히 하고 '확정된 환불 금액'을 입력으로 주입하지 않는다.",
    "결제 취소 결과의 취소결과·환불결과·상태변화 열을 각각 서로 구별되는 관찰 가능한 도메인 상태명으로 값 고정한다(정성 서술 대신 결과 상태명).",
    "PRORATION 잔여일수==총일수(경과 8일 이상 맥락에서의 전액 경계)나 MANUAL 지정금액이 환불 가능 금액과 정확히 같은 경계 등, 정책이 함의하나 값으로 안 잡힌 경계가 있는지 각 표를 한 번 더 훑어 누락 경계 행동만 채운다(내부 연산 시나리오로 채우지 말 것)."
  ],
  "reader_risks": [
    "결제취소_결과_처리에서 When이 '환불을 요청하면'이라, 구현자가 결제 취소 결과 처리기를 문자 그대로 환불 요청 재호출로 배선했다가 결과 처리 진입점을 분리하는 리팩터링 시 이 feature가 구현 종속으로 가짜로 깨질 수 있다.",
    "환불유형_결정이 '확정된 환불 금액'을 입력으로 받아, 독자가 금액을 직접 받는 별도 공개 API가 존재한다고 오해하고 그 시그니처를 고정해버릴 위험이 있다 — 유형이 환불 요청 흐름에 통합되면 이 가정이 깨진다.",
    "환불금액_결정의 2331원 같은 절사 결과 값이 산식 없이 놓여 있어, 독자가 근거를 모른 채 매직 넘버로 받아들이거나 rules 문서의 반올림 규칙이 바뀌어도 이 값이 조용히 어긋날 수 있다(경계-rules 결합을 명시적으로 관리해야 함).",
    "'수락된다/거절된다', '관리자 수동 처리 대상이 된다' 같은 서술형 Then은 관찰 가능한 도메인 결과 상태로 못 박지 않으면, 인접 오답 구현(실패↔타임아웃, 부분↔전액)에서도 통과해 red를 놓칠 위험이 있다."
  ],
  "critiqued_at": "2026-07-21T20:25:14+09:00",
  "model": "claude-sonnet-4-6",
  "metadata": {
    "prompt_version": "critique_system:v1",
    "source_files": [
      "f1ba346d_input.json",
      "f1ba346d_iter-001_draft.json"
    ]
  }
}
