{
  "brief_hash": "f1ba346d",
  "iteration": "001",
  "summary": "산식·경계·불변식을 값으로 고정한 규칙표로, PRORATION의 floor 위치(2331)와 전액 특례의 load-bearing함(29↔30)을 witness로 잘 못박았고 D 섹션이 ∀ 전칭+등호 witness 형식을 지킨다. 다만 표의 거의 모든 환불가능금액 행이 '이미환불=0인 fresh 주문'만 담아 환불가능금액이 주문금액과 분리되는 축이 고정되지 않았고, totalDays≤0 예외와 상한 위반(밖) 행이 표 본문에서 빠져 특수해가 통과할 여지가 있다.",
  "strengths": [
    "A-1의 29↔30 짝이 전액 특례를 load-bearing으로 증언한다(산식값 9990 vs 특례 10000). 특례가 산식에 흡수되어 사라지는 것을 막아, 이 규칙에 대한 반례(특례 무시 구현)가 표를 통과하지 못한다.",
    "2331 witness가 floor 위치를 고정한다 — floor(10000/30)×7=2331은 floor(10000×7/30)=2333과 갈려, '단가 절사 후 곱'과 '곱 후 절사' 구현을 구별해낸다. 검산 근거가 산식에서 재계산으로 도출된다.",
    "C-1 주문 상태 검증이 결제완료/부분환불/전액환불/결제대기/결제실패 5종을 전수 열거해 유한 도메인을 완전히 덮는다. 특정 상태만 외운 특수해가 숨을 곳이 없어 반례를 구성하지 못한다(충분히 좁혀짐).",
    "D-2가 (합==주문금액) ⟺ 전액환불을 ∀ 전칭으로 올리고 10000/9999 등호 직전·직후 짝으로 동치 경계를 tight하게 봉인한다. '항상 부분환불만 내는' 사소 구현이 등호 witness에서 걸린다.",
    "주문·환불 상태를 결제완료/요청됨 등 한국어 도메인 어휘로 표기해 PAID/REFUNDED 같은 enum 상수 노출을 회피했다(인터페이스 불가지 유지)."
  ],
  "weaknesses": [
    {
      "issue": "MANUAL 유효성(A-2)의 모든 행이 환불가능금액=10000이고 이는 '이미환불된금액=0인 전액 주문'과 구별되지 않는다. 즉 상한 비교 대상이 주문금액인지 환불가능금액(=주문금액−이미환불)인지 표가 고정하지 못한다.",
      "why_it_matters": "정책은 '부분 환불 후 환불가능금액 = amount − canceledAmount로 재계산'과 '지정금액 > 환불가능금액 → 오류'를 함께 명시한다. 반례: MANUAL 상한을 주문금액과 비교하는 구현(if manualAmount ≤ orderAmount)은 A-2의 모든 행을 통과하지만, 이미 4000이 환불된 10000원 주문에 6001원 MANUAL을 허용해 환불가능금액 6000을 초과 — 정책이 실제로 금지하는 초과 환불을 잠근다.",
      "suggestion": "이미환불된금액>0으로 환불가능금액이 주문금액과 갈라지는 MANUAL 경계 안·밖 짝을 추가하라. 예: 주문금액 10000 / 이미환불 4000 / 환불가능 6000 / 지정 6000 → 유효(상한 등호), 지정 6001 → 오류(상한 밖). 반례 자체가 아니라 이 경계 행을 명세에 남긴다.",
      "severity": "high"
    },
    {
      "issue": "totalDays ≤ 0(잘못된 구독 기간) → 예외 규칙이 규칙표에 없다. A-1은 총구독일수>0을 암묵 전제만 하고, 총구독일수=0 경계 행이 부재하다.",
      "why_it_matters": "정책 §6-1은 'totalDays<=0 | 잘못된 구독 기간 | 예외 발생'을 명시한다. 표에 이 경계가 없으면 0 나눗셈 방어를 하지 않은 구현(크래시)이나 0을 반환하는 구현이 모두 표를 통과 — 정책이 요구하는 예외 발동이 구현자 재량으로 흩어진다.",
      "suggestion": "A-1에 총구독일수 하한 경계 안·밖 짝을 추가하라: 총구독일수=0 → 예외(밖), 총구독일수=1 → 정상 산출(안, 예: 결제금액 10000/총구독일수 1/잔여 1 → 10000). 검산 근거를 함께 단다.",
      "severity": "medium"
    },
    {
      "issue": "D-1 불변식(0 < 이번환불금액 ≤ 환불가능금액)의 표에 등호 witness(7000=7000) 한 행만 있고, 상한을 넘는 위반(밖) 행이 표 본문에 없다 — 7001→오류는 검산 산문에만 있다.",
      "why_it_matters": "경계 축은 안·밖 짝이 있어야 특수해를 막는다. 표만 읽는 구현자에게 '등호는 허용, 초과는 오류'라는 경계가 행으로 고정되지 않아, 상한을 < (미만)으로 잘못 구현해 등호 witness를 실패시키거나 초과 처리를 누락할 수 있다.",
      "suggestion": "D-1 표에 이번환불금액=7001(환불가능 7000) → 오류 행을 밖 witness로 승격하라. 등호 witness(7000)와 짝을 이뤄 '≤에서 등호 포함'을 표로 증언하게 한다.",
      "severity": "medium"
    },
    {
      "issue": "7일 무료(A-3)의 '전액 환불'이 결제금액인지 환불가능금액인지, 이미 부분환불된 주문에 적용될 때 모호하다. 표는 항상 잔여일수=총구독일수 계열의 fresh 주문(전액=결제금액)만 담는다.",
      "why_it_matters": "무료 규칙을 경과일≤7인 부분환불(이미환불>0) 주문에 적용하면 '전액=결제금액' 환불이 환불가능금액(=결제금액−이미환불)을 초과해 D-1 상한 불변식과 정면 충돌한다. 정책은 무료의 대상 주문 상태나 '전액'의 기준을 명시하지 않아 반례(무료로 결제금액 전액을 밀어 초과 환불)가 성립할 수 있다.",
      "suggestion": "무료 적용 시 '전액'이 환불가능금액(min)임을 명문화하거나, 무료 규칙이 이미환불=0 상태에만 적용됨을 제약으로 적어라. 후자라면 경과일≤7 + 이미환불>0 조합의 경계 행을 추가해 어느 정책이 발동하는지 고정한다.",
      "severity": "medium"
    },
    {
      "issue": "정책명 PRORATION·MANUAL이 규칙 서술에 영문 상수로 남아 있다. 주문·환불 상태는 한국어 도메인 어휘로 강등했는데 산출 정책명만 영문 enum 형태로 노출된다.",
      "why_it_matters": "인터페이스 불가지 원칙과 미세하게 불일치하며, 구현자가 RefundPolicy enum 상수명을 명세가 지정한 것으로 오독할 여지를 남긴다(상태는 이미 한국어로 뒀으므로 기준이 섞인다).",
      "suggestion": "'일할 계산'·'수동 지정' 같은 도메인 어휘로 통일하거나, 영문명이 정책 원문 어휘의 참조일 뿐 타입명이 아님을 서두 각주로 명시하라.",
      "severity": "low"
    }
  ],
  "revision_directions": [
    "환불가능금액이 주문금액과 분리되는 witness(이미환불>0)를 A-2(MANUAL 상한)·B-1(유형)·A-3(무료)에 넣어, 모든 상한/유형 판정이 '주문금액'이 아니라 '환불가능금액=주문금액−이미환불'을 기준으로 함을 표로 고정하라.",
    "검산 산문에만 있던 경계를 표 본문 행으로 승격하라: totalDays=0→예외 / totalDays=1→정상(A-1), 이번환불금액=7001→오류(D-1). 안·밖 짝으로 만든다.",
    "7일 무료의 '전액' 기준(결제금액 vs 환불가능금액)과 적용 대상 주문 상태를 명확히 하여 D-1 불변식과 상충하지 않게 하라."
  ],
  "reader_risks": [
    "MANUAL·유형·무료 표가 모두 환불가능금액=주문금액인 fresh 주문만 담아, 구현자가 상한을 주문금액으로 오독하고 부분환불된 주문에서 초과 환불을 허용하도록 규칙이 잘못 잠길 위험.",
    "totalDays≤0 예외가 표에 없어 0 나눗셈 처리(예외 vs 0 반환 vs 크래시)가 구현자 재량으로 흩어질 위험.",
    "D-1 상한 위반(7001) 행이 산문 검산에만 있어, 표만 읽는 구현자가 ≤의 등호 포함/초과 오류 처리를 놓칠 위험.",
    "7일 무료의 '전액'이 결제금액으로 굳어지면 부분환불 주문에서 환불가능금액을 넘겨, 무료 규칙과 상한 불변식이 서로를 반증하는 모순으로 규칙이 잠길 위험."
  ],
  "critiqued_at": "2026-07-21T22:34:26+09:00",
  "model": "claude-sonnet-4-6",
  "metadata": {
    "prompt_version": "critique_system:v1",
    "source_files": [
      "f1ba346d_input.json",
      "f1ba346d_iter-001_draft.json"
    ]
  }
}
