{
  "brief_hash": "f1ba346d",
  "iteration": "001",
  "summary": "규칙 대부분이 산식과 함께 재계산 가능한 안/밖 경계 짝으로 잘 고정됐고, 두 불변식은 ∀ 전칭 문장 + 등호 tight witness로 올바르게 승격됐다. 다만 PRORATION의 '당일=전액' 특수규칙과 환불유형 판정이 각각 floor 손실·부분환불(c>0) 상황을 witness하지 못해 if-분기 특수해로 통과되며, 환불유형(FULL/PARTIAL)과 주문상태전이(REFUNDED/PARTIALLY_REFUNDED)를 잇는 커플링 불변식이 빠져 있다.",
  "strengths": [
    "두 불변식(환불가능금액 상한 c+r≤a, 환불금액 하한 r≥0/MANUAL r>0)을 예시표로 강등하지 않고 ∀ 전칭 문장 + 등호 tight witness 행으로 올려, 상수·특수해가 아니라 전칭이 출력을 고정하도록 한 점. 상한 불변식은 PRORATION/MANUAL 표가 구체 r을 못박아 'r=0 상수' 사소구현을 함께 배제한다.",
    "MANUAL 표의 상한(10000 허용 / 10001 오류)·하한(1 허용 / 0 오류) 경계 안/밖 짝이 모두 있어, 각 경계에서 '='을 어느 쪽에 두는지 구현이 특수해로 뚫을 여지가 좁다 — 반례를 구성하지 못함(충분히 좁혀짐).",
    "환불(Refund) 상태 전이가 동일 입력 REQUESTED에서 성공/명확거부/불확실 세 사건→세 결과로 삼분기돼 있고, 환불 가능 여부 표는 허용 {PAID, PARTIALLY_REFUNDED} 2개와 그 밖 3개 상태를 모두 열거해 상태집합 소속 경계가 exhaustive하다 — 둘 다 반례 구성 실패(좁혀짐).",
    "모든 금액 기대값에 floor 산식과 검산 문자열이 붙어 있어 재계산 검증이 가능하고, 클래스·메서드·시그니처를 노출하지 않고 도메인 수량·어휘로만 서술했다."
  ],
  "weaknesses": [
    {
      "issue": "PRORATION 표가 '잔여==총일수 → 전액 환불' 특수규칙을 floor 손실이 드러나는 값으로 witness하지 않는다. 유일한 전액 행이 (결제금액 30000, 총일수 30)이라 floor(30000/30)×30 = 30000으로 산식과 전액이 우연히 일치한다. 반례: 산식 그대로 floor(결제금액/총일수)×잔여일수만 계산하는 구현(전액 특수분기 없음)에 (결제금액 10000, 총일수 30, 잔여일수 30)을 넣으면 floor(10000/30)×30 = 333×30 = 9990을 내지만 정책은 전액 10000을 요구한다 — 이 구현은 draft의 모든 행을 통과한다.",
      "why_it_matters": "정책 4-1은 '잔여==총일수(당일 환불) → 전액 환불'을 산식과 별개의 규칙으로 명시하는데, 이 규칙은 floor(price/totalDays)×totalDays < price일 때만 산식과 갈라진다. 갈라지는 값이 표에 없으면 구현자가 특수분기를 생략해도 표를 통과해, 당일 환불이 결제금액보다 적게 잠기는 오구현이 명세로 정당화된다.",
      "suggestion": "floor 손실이 나는 전액 경계 행을 추가한다 — 예: 결제금액 10000, 총일수 30, 잔여일수 30 → 환불금액 10000(전액; 산식값 9990이 아님). 검산에 'floor(10000/30)×30=9990 ≠ 전액 10000이므로 당일 환불은 산식이 아니라 결제금액 전액을 반환'을 명기한다.",
      "severity": "high"
    },
    {
      "issue": "환불 유형 결정 표의 두 행이 모두 이미 환불된 금액 c=0 상황(환불가능금액이 곧 주문금액)이라, '환불가능금액 기준'과 '주문금액 기준'을 구별하지 못한다. 반례: 환불금액을 주문금액과 비교하는 구현에 부분환불 후(주문금액 10000, 이미 환불 3000 → 환불가능금액 7000) 환불금액 7000을 넣으면, 환불가능금액 기준으론 FULL이어야 하나 주문금액 기준 구현은 7000<10000이라 PARTIAL을 내며 draft의 두 행을 모두 통과한다.",
      "why_it_matters": "정책(§5, 결정사항의 'amount − canceledAmount로 재계산')은 유형을 환불가능금액 기준으로 판정하라고 정하는데, c>0인 witness가 없으면 주문금액 기준 오구현이 표를 통과해 '부분환불 후 잔액 전액환불'이 PARTIAL로 잘못 잠긴다.",
      "suggestion": "c>0인 경계 행을 추가한다 — 예: 환불금액 7000, 환불가능금액 7000(주문금액 10000·이미 환불 3000에서 도출) → FULL. 환불가능금액 셀 옆에 (주문금액−이미환불) 도출을 병기해 주문금액과 다름을 드러낸다.",
      "severity": "high"
    },
    {
      "issue": "환불 유형(FULL/PARTIAL)과 주문 상태 전이(REFUNDED/PARTIALLY_REFUNDED)를 잇는 커플링 불변식이 없다. 두 표가 독립적이라, FULL을 내면서 주문을 PARTIALLY_REFUNDED로 두거나 그 반대인 구현이 각 표를 따로 통과한다. 반례: 유형은 환불가능금액 기준으로, 상태전이는 누적취소액 기준으로 판정하되 둘을 연동하지 않는 구현은 FULL + PARTIALLY_REFUNDED 조합을 산출할 수 있다.",
      "why_it_matters": "FULL ⟺ 환불금액==환불가능금액 ⟺ 누적취소액==주문금액 ⟺ 결과상태 REFUNDED는 정책상 같은 사건이다. 이 등가를 명세가 고정하지 않으면 유형과 상태가 어긋난 주문이 명세를 통과해, 감사·후속 바인딩에서 모순 상태가 정본이 된다.",
      "suggestion": "전칭 불변식을 추가한다 — ∀(확정 환불 적용). 결과 유형이 FULL ⟺ 결과 주문 상태가 REFUNDED, 결과 유형이 PARTIAL ⟺ 결과 상태가 PARTIALLY_REFUNDED. 두 방향(FULL·REFUNDED / PARTIAL·PARTIALLY_REFUNDED)을 tight witness 2행으로 동반한다.",
      "severity": "medium"
    },
    {
      "issue": "7일 이하 무료가 '전액 환불 = 결제금액'으로만 정의돼, 이미 부분환불된 주문(이미 환불된 금액 c>0)에서의 무료 환불이 미정의다. 무료 행 3개 모두 c=0을 전제한다. 반례: 주문금액 10000·이미 환불 3000(환불가능금액 7000)인 주문에 경과일 5일로 무료를 적용하는 구현이 '전액=결제금액 10000'을 반환하면 c+r = 3000+10000 = 13000 > 10000으로 상한 불변식 c+r≤a를 위반하는데, 무료 표만 보면 이 값이 정당해 보인다.",
      "why_it_matters": "무료(전액)와 상한 불변식(환불가능금액 초과 불가)이 c>0에서 충돌하는데, '전액'이 결제금액인지 환불가능금액(a−c)인지 명세가 정하지 않아 구현이 어느 쪽으로도 잠글 수 있다. 상한 불변식을 깨는 해석이 무료 표로 정당화된다.",
      "suggestion": "무료의 '전액'을 환불가능금액(a−c)으로 못박고, c>0 경계 행을 추가한다 — 예: 주문금액 10000, 이미 환불 3000, 경과일 5 → 환불금액 7000(=환불가능금액, 결제금액 10000이 아님). 무료 규칙 서술에 '전액=환불가능금액이며 상한 불변식에 종속'을 명기한다.",
      "severity": "medium"
    }
  ],
  "revision_directions": [
    "PRORATION 표에 floor 손실이 나는 전액 경계 행(10000/30/30 → 10000)을 추가하고, 산식값 9990과 전액 10000이 갈리는 검산을 병기해 '당일=전액' 특수분기를 witness한다.",
    "환불 유형·무료 표에 이미 환불된 금액 c>0인 경계 행을 각각 추가해, 판정 기준이 주문금액이 아니라 환불가능금액(a−c)임을 witness한다.",
    "FULL⟺REFUNDED / PARTIAL⟺PARTIALLY_REFUNDED 커플링을 ∀ 전칭 불변식 + 양방향 tight witness 2행으로 추가해 유형·상태 두 판정의 등가를 고정한다.",
    "무료 규칙의 '전액'을 환불가능금액으로 정의하고 상한 불변식 종속을 명문화해, c>0에서 c+r≤a와의 충돌을 제거한다."
  ],
  "reader_risks": [
    "PRORATION 전액 경계가 floor 손실 없는 값으로만 예시돼, 구현자가 당일 환불에 산식(floor(price/total)×remaining)을 그대로 써 결제금액보다 적은 금액(예: 9990)을 잘못 잠글 위험.",
    "환불 유형·무료가 c=0 예시로만 채워져, 부분환불 이후 판정 기준을 주문금액으로 오해하고 '부분환불 후 잔액 전액환불'을 PARTIAL로 잘못 잠글 위험.",
    "유형과 주문 상태가 별도 표로 제시돼 둘의 등가가 안 보이므로, FULL이면서 PARTIALLY_REFUNDED처럼 서로 어긋난 결과 상태를 허용하는 구현이 명세를 통과할 위험.",
    "무료의 '전액'이 결제금액인지 환불가능금액인지 모호해, c>0 주문에서 상한 불변식(c+r≤a)을 초과하는 무료 환불을 정당한 것으로 오독할 위험."
  ],
  "critiqued_at": "2026-07-21T23:14:55+09:00",
  "model": "claude-sonnet-4-6",
  "metadata": {
    "prompt_version": "critique_system:v1",
    "source_files": [
      "f1ba346d_input.json",
      "f1ba346d_iter-001_draft.json"
    ]
  }
}
