{
  "brief_hash": "9885d9d1",
  "iteration": "002",
  "summary": "현재 feature는 하나의 유스케이스 호출로 상방·하방 발화와 미발화 조건을 관찰 가능한 결과로 고정하고 있어 boundary feature의 기본 골격은 좋습니다. 다만 일부 경계 행동은 리팩터링 게이트로 쓰기에는 단언이 약하거나 입력 경계가 약간 흔들립니다.",
  "strengths": [
    "모든 시나리오의 When이 \"닫힌 캔들열로 볼린저밴드 레그 트리거 발화를 평가\"하는 하나의 유스케이스 경계 호출로 유지되어 inbound port 1:1 성격이 잘 보존되어 있습니다.",
    "상방과 하방 정상 발화에서 방향, 진입가, 손절가, 목표가, 시한을 구체 값으로 관찰해 결과 계약이 명확합니다.",
    "각 발화 조건의 반례를 Scenario Outline으로 분리해 네 조건 중 하나라도 깨지면 미발화한다는 경계 행동을 비교적 잘 고정했습니다.",
    "리스크 0 미발화와 닫힌 캔들만 평가한다는 정책상 중요한 거절 행동을 별도 시나리오로 다루고 있습니다."
  ],
  "weaknesses": [
    {
      "issue": "닫히지 않은 최신 캔들 시나리오의 입력 경계가 모호합니다.",
      "why_it_matters": "When은 닫힌 캔들열을 입력으로 평가한다고 말하지만 Given에는 닫히지 않은 최신 캔들이 포함됩니다. 이러면 유스케이스가 애초에 닫힌 캔들만 받는지, 원시 캔들열에서 닫히지 않은 캔들을 걸러야 하는지 경계 책임이 흔들립니다.",
      "suggestion": "정책이 유스케이스 입력을 닫힌 캔들열로 한정한다면, 이 시나리오는 마지막 닫힌 캔들이 구체적으로 미발화 값이라는 점만 고정하도록 바꾸는 것이 좋습니다. 반대로 유스케이스가 미확정 캔들을 포함한 조회 결과를 받는 경계라면, 입력 이름을 그렇게 명시하고 결과는 닫힌 기준봉만으로 없다고 관찰하게 하세요.",
      "severity": "medium"
    },
    {
      "issue": "동시 발화 불가 시나리오가 리팩터링 게이트로는 약합니다.",
      "why_it_matters": "현재 값은 상방 정상 발화 예시와 거의 같아서, 한 캔들에서 하방 결과가 함께 나오지 않는다는 정책을 별도로 압박하지 못합니다. 결과 1개와 상방 방향 단언은 도움이 되지만, 잘못된 구현이 방향별 평가를 오염시키는 경우를 충분히 드러내지 못할 수 있습니다.",
      "suggestion": "동일한 기준 캔들에 대해 상방 결과만 관찰되고 하방 결과는 없다는 표현을 더 직접적인 Then으로 고정하세요. 필요하면 하방 정상 발화 값에서도 대칭적으로 상방 결과가 없다는 경계 행동을 추가하되, 내부 계산 과정은 feature에 넣지 마세요.",
      "severity": "medium"
    },
    {
      "issue": "스퀴즈 경계값은 참과 거짓을 모두 다루지만 결과가 갈리는 경계 의미가 독자에게 약하게 고정됩니다.",
      "why_it_matters": "정상 발화는 기준 밴드폭과 25백분위 밴드폭이 같은 값이고, 거절 예시는 0.101 대 0.10입니다. 값 자체는 구체적이지만 이 경계가 포함 경계인지 초과 거절인지가 Then만 보고는 강하게 드러나지 않아 구현이 '<'와 '<='를 바꿔도 일부 시나리오만으로는 의도를 놓칠 수 있습니다.",
      "suggestion": "스퀴즈 전제의 포함 경계를 별도 경계 행동으로 이름 붙여, 기준 밴드폭 0.10과 25백분위 밴드폭 0.10이면 발화 가능하고 0.101과 0.10이면 미발화한다는 두 값을 유지해 주세요. 그 값이 어떻게 산출되는지는 rules 문서 몫으로 남기면 됩니다.",
      "severity": "low"
    }
  ],
  "revision_directions": [
    "닫히지 않은 캔들 시나리오는 유스케이스 입력 책임을 먼저 하나로 고정한 뒤, 그 책임에 맞는 관찰 결과만 남기세요.",
    "동시 발화 불가와 방향 독립성은 결과 목록에 특정 방향만 존재한다는 경계 관찰로 더 명확히 표현하세요.",
    "스퀴즈 임계값은 포함 경계와 초과 거절 경계를 독자가 바로 비교할 수 있도록 시나리오 이름과 구체 값을 맞춰 정리하세요.",
    "산식, 중간값, 호출 횟수, 내부 상태 단언은 계속 feature 밖에 두고 rules 문서의 책임으로 유지하세요."
  ],
  "reader_risks": [
    "미확정 캔들 처리가 유스케이스 책임인지 입력 어댑터 책임인지 헷갈리면 리팩터링 중 경계가 바뀌어도 feature가 같은 의미로 유지되지 않을 수 있습니다.",
    "동시 발화 불가가 단순 상방 정상 발화 예시처럼 읽히면, 방향별 결과가 동시에 생성되는 결함을 막는 게이트로 약하게 작동할 수 있습니다.",
    "스퀴즈 경계가 포함 조건임을 독자가 놓치면 임계값 비교 연산 변경 같은 작은 리팩터링에서 feature 의도가 잘못 해석될 수 있습니다."
  ],
  "critiqued_at": "2026-07-24T00:04:06+09:00",
  "model": "gpt-5.5",
  "metadata": {
    "prompt_version": "critique_system:v1",
    "source_files": [
      "9885d9d1_input.json",
      "9885d9d1_iter-002_draft.json"
    ],
    "token_usage": {
      "input_tokens": 28703,
      "cached_input_tokens": 1408,
      "cache_write_input_tokens": 0,
      "output_tokens": 1736,
      "reasoning_output_tokens": 516
    }
  }
}
